{
  "screenshot_id": "fc8b62c7-4a23-464f-bc56-89e868c13718",
  "name": "hierarchy_001_no_focal_point",
  "expected_findings": [
    {
      "dimension": "visual_hierarchy",
      "issue": "no_focal_point",
      "severity": "medium",
      "location": {
        "component_ids": [
          "comp_0",
          "comp_1",
          "comp_2",
          "comp_3",
          "comp_4",
          "comp_5"
        ]
      },
      "rationale": "Injected issue: no_focal_point"
    }
  ],
  "tolerance": {
    "severity_flexibility": false,
    "max_extra_findings": 2
  },
  "created": "2026-03-13T13:21:43.542029"
}