{
  "screenshot_id": "1eb64a35-a120-4121-b749-33a28dde06a1",
  "name": "color_002_accessibility",
  "expected_findings": [
    {
      "dimension": "accessibility",
      "issue": "color_accessibility",
      "severity": "high",
      "location": {
        "component_ids": [
          "comp_0",
          "comp_1",
          "comp_2"
        ]
      },
      "rationale": "Injected issue: color_accessibility"
    }
  ],
  "tolerance": {
    "severity_flexibility": false,
    "max_extra_findings": 2
  },
  "created": "2026-03-13T13:21:43.639909"
}