{
  "screenshot_id": "688837db-e96f-48be-bd86-86cafeb4afea",
  "name": "typography_001_small_font",
  "expected_findings": [
    {
      "dimension": "typography",
      "issue": "font_size_too_small",
      "severity": "high",
      "location": {
        "component_ids": [
          "comp_0",
          "comp_1"
        ]
      },
      "rationale": "Injected issue: font_size_too_small"
    }
  ],
  "tolerance": {
    "severity_flexibility": false,
    "max_extra_findings": 2
  },
  "created": "2026-03-13T13:21:43.606539"
}