{
  "screenshot_id": "3ddc6cec-2563-4913-810d-8356c191419d",
  "name": "spacing_002_inconsistent_rhythm",
  "expected_findings": [
    {
      "dimension": "spacing_rhythm",
      "issue": "inconsistent_rhythm",
      "severity": "medium",
      "location": {
        "component_ids": [
          "comp_0",
          "comp_1",
          "comp_2",
          "comp_3"
        ]
      },
      "rationale": "Injected issue: inconsistent_rhythm"
    }
  ],
  "tolerance": {
    "severity_flexibility": false,
    "max_extra_findings": 2
  },
  "created": "2026-03-13T13:21:43.587723"
}