{
  "screenshot_id": "eaf6f2e5-adde-4117-80d5-1fe4c4890533",
  "name": "components_002_style_proliferation",
  "expected_findings": [
    {
      "dimension": "components",
      "issue": "style_proliferation",
      "severity": "low",
      "location": {
        "component_ids": [
          "comp_0",
          "comp_1",
          "comp_2",
          "comp_3",
          "comp_4",
          "comp_5"
        ]
      },
      "rationale": "Injected issue: style_proliferation"
    }
  ],
  "tolerance": {
    "severity_flexibility": false,
    "max_extra_findings": 2
  },
  "created": "2026-03-13T13:21:43.688386"
}