{
  "screenshot_id": "cac09222-9f6f-42e3-a58c-f27b25564cfc",
  "name": "components_001_size_inconsistency",
  "expected_findings": [
    {
      "dimension": "components",
      "issue": "size_inconsistency",
      "severity": "low",
      "location": {
        "component_ids": [
          "comp_0",
          "comp_1",
          "comp_2"
        ]
      },
      "rationale": "Injected issue: size_inconsistency"
    }
  ],
  "tolerance": {
    "severity_flexibility": false,
    "max_extra_findings": 2
  },
  "created": "2026-03-13T13:21:43.679774"
}