{
  "screenshot_id": "ec7b3d63-523b-4d05-bc39-e7bd96fcffe7",
  "name": "alignment_002_misalignment",
  "expected_findings": [
    {
      "dimension": "alignment_grid",
      "issue": "misalignment",
      "severity": "medium",
      "location": {
        "component_ids": [
          "comp_0",
          "comp_1",
          "comp_2",
          "comp_3"
        ]
      },
      "rationale": "Injected issue: misalignment"
    }
  ],
  "tolerance": {
    "severity_flexibility": false,
    "max_extra_findings": 2
  },
  "created": "2026-03-13T13:21:43.665222"
}