{
  "screenshot_id": "e0fef7f8-d894-448a-9760-16632a7826fd",
  "name": "density_001_too_dense",
  "expected_findings": [
    {
      "dimension": "density",
      "issue": "too_dense",
      "severity": "medium",
      "location": {
        "component_ids": [
          "comp_0",
          "comp_1",
          "comp_2",
          "comp_3",
          "comp_4",
          "comp_5",
          "comp_6",
          "comp_7",
          "comp_8",
          "comp_9",
          "comp_10",
          "comp_11",
          "comp_12",
          "comp_13",
          "comp_14",
          "comp_15",
          "comp_16",
          "comp_17",
          "comp_18",
          "comp_19"
        ]
      },
      "rationale": "Injected issue: too_dense"
    }
  ],
  "tolerance": {
    "severity_flexibility": false,
    "max_extra_findings": 2
  },
  "created": "2026-03-13T13:21:43.720146"
}