{
  "screenshot_id": "1c6c07c5-ec5c-498f-b84f-e6f8bbd1b7f4",
  "name": "states_001_missing_empty",
  "expected_findings": [
    {
      "dimension": "empty_states",
      "issue": "missing_empty_state",
      "severity": "low",
      "location": {
        "component_ids": [
          "comp_0",
          "comp_1"
        ]
      },
      "rationale": "Injected issue: missing_empty_state"
    }
  ],
  "tolerance": {
    "severity_flexibility": false,
    "max_extra_findings": 2
  },
  "created": "2026-03-13T13:21:43.703548"
}